image,text,label,original_dataset_id,dataset_source
id_133_Positional_sd_1_4_0.png,A zebra to the right of a fire hydrant.,0,text_133_image_1228,drawbench
id_105_coco_val_0.png,A group of people standing next to bags of luggage.,1,text_105_image_1377,coco_t2i
id_178_sd_1_4_1.png,The old tow truck tries to lift an overturned truck that's on it's side.,0,text_178_image_2319,coco_t2i
id_103_Gary Marcus et al. _sd_2_1_1.png,Abraham Lincoln touches his toes while George Washington does chin-ups. Lincoln is barefoot. Washington is wearing boots.,0,text_103_image_993,drawbench
id_3_sd_2_1_0.png,A cat on the lid of a toilet looking perturbed.,1,text_3_image_47,coco_t2i
id_98_sd_2_1_0.png,A train pulls up along some buildings.,1,text_98_image_1282,coco_t2i
id_161_Reddit_sd_2_1_0.png,"A keyboard made of water, the water is made of light, the light is turned off.",0,text_161_image_1520,drawbench
id_182_Text_sd_2_1_0.png,A storefront with 'NeurIPS' written on it.,0,text_182_image_1760,drawbench
id_144_Reddit_sd_1_4_2.png,A photo of a confused grizzly bear in calculus class.,1,text_144_image_1350,drawbench
id_40_coco_val_0.png,A baseball player is swinging and about to run.,1,text_40_image_532,coco_t2i
id_3_Colors_sd_1_4_1.png,A black colored dog.,1,text_3_image_41,drawbench
id_125_coco_val_0.png,Girl trying out a game at a trade show.,1,text_125_image_1637,coco_t2i
id_131_Positional_sd_1_4_2.png,A stop sign on the right of a refrigerator.,1,text_131_image_1206,drawbench
id_45_coco_val_0.png,a women that is walking down a sidwalk,1,text_45_image_597,coco_t2i
id_32_Conflicting_sd_1_4_2.png,An elephant under the sea.,0,text_32_image_390,drawbench
id_21_Colors_sd_2_1_2.png,A brown bird and a blue bear.,0,text_21_image_262,drawbench
id_27_coco_val_0.png,A grasshopper in a cage eating a slice of carrot.,1,text_27_image_363,coco_t2i
id_194_sd_1_4_2.png,A person on a snow board high up in the air.,0,text_194_image_2528,coco_t2i
id_27_sd_1_4_2.png,A grasshopper in a cage eating a slice of carrot.,1,text_27_image_357,coco_t2i
id_129_Positional_sd_1_4_2.png,A pizza on the right of a suitcase.,0,text_129_image_1182,drawbench
id_1_Colors_sd_2_1_2.png,A black colored car.,1,text_1_image_22,drawbench
id_125_Positional_sd_1_4_0.png,A couch on the left of a chair.,0,text_125_image_1132,drawbench
id_64_DALL-E_sd_1_4_3.png,An illustration of a small green elephant standing behind a large red mouse.,0,text_64_image_775,drawbench
id_148_Reddit_sd_2_1_3.png,A 1960s yearbook photo with animals dressed as humans.,0,text_148_image_1403,drawbench
id_70_DALL-E_sd_1_4_1.png,"An emoji of a baby panda wearing a red hat, blue gloves, green shirt, and blue pants.",0,text_70_image_845,drawbench
id_194_sd_1_4_3.png,A person on a snow board high up in the air.,0,text_194_image_2529,coco_t2i
id_44_Counting_sd_1_4_0.png,Five dogs on the street.,1,text_44_image_532,drawbench
id_196_Text_sd_1_4_3.png,New York Skyline with 'NeurIPS' written with fireworks on the sky.,0,text_196_image_1927,drawbench
id_94_sd_2_1_2.png,"A road wet from rain, and clouds still on the mountain. ",1,text_94_image_1232,coco_t2i
id_69_DALL-E_sd_1_4_2.png,"An emoji of a baby panda wearing a red hat, green gloves, red shirt, and green pants.",0,text_69_image_834,drawbench
id_174_sd_1_4_0.png,A red fire hydrant sitting in the middle of the grass.,1,text_174_image_2266,coco_t2i
id_191_sd_2_1_0.png,A large plate is adorned with broccoli and a rather small piece of meat.,0,text_191_image_2491,coco_t2i
id_108_sd_2_1_3.png,a girl jumping in the air to catch a frisbee,0,text_108_image_1415,coco_t2i
id_27_Conflicting_sd_1_4_2.png,A bird scaring a scarecrow.,0,text_27_image_330,drawbench
id_124_Positional_sd_1_4_3.png,A banana on the left of an apple.,0,text_124_image_1123,drawbench
id_21_Colors_sd_1_4_2.png,A brown bird and a blue bear.,0,text_21_image_258,drawbench
id_100_sd_1_4_3.png,Two baby gray elephants standing in front of each other.,1,text_100_image_1307,coco_t2i
id_130_Positional_sd_1_4_2.png,A cat on the right of a tennis racket.,0,text_130_image_1194,drawbench
id_83_sd_1_4_2.png,female tennis player running to intercept the ball,1,text_83_image_1085,coco_t2i
id_184_sd_2_1_0.png,A cup filled with umbrellas and canes next to a white wall.,0,text_184_image_2400,coco_t2i
id_63_sd_2_1_0.png,One light brown cow with hay in it's mouth.,1,text_63_image_827,coco_t2i
id_161_Reddit_sd_2_1_1.png,"A keyboard made of water, the water is made of light, the light is turned off.",0,text_161_image_1521,drawbench
id_189_sd_2_1_0.png,A plate of chicken with herbs and steamed broccoli.,1,text_189_image_2465,coco_t2i
id_112_sd_2_1_1.png,A table filled with a cake and paper plates with ice cream and cake.,1,text_112_image_1465,coco_t2i
id_99_Gary Marcus et al. _sd_1_4_3.png,A tomato has been put on top of a pumpkin on a kitchen stool. There is a fork sticking into the pumpkin. The scene is viewed from above.,0,text_99_image_943,drawbench
id_173_Reddit_sd_2_1_0.png,"A car playing soccer, digital art.",1,text_173_image_1664,drawbench
id_137_sd_2_1_0.png,Two giraffes standing outdoors near a brick building.,1,text_137_image_1789,coco_t2i
id_62_DALL-E_sd_2_1_1.png,A couple of glasses are sitting on a table.,0,text_62_image_753,drawbench
id_0_sd_1_4_0.png,A child holding a flowered umbrella and petting a yak.,0,text_0_image_4,coco_t2i
id_183_sd_1_4_2.png,Dog lying on bedding material in suitcase in large room.,0,text_183_image_2385,coco_t2i
id_181_Text_sd_1_4_0.png,A storefront with 'Text to Image' written on it.,0,text_181_image_1744,drawbench
id_31_Conflicting_sd_2_1_3.png,A shark in the desert.,1,text_31_image_383,drawbench
id_29_sd_2_1_3.png,Persons skating in the ice skating rink on the skateboard.,1,text_29_image_388,coco_t2i
id_185_sd_1_4_1.png,The man is posing with his umbrella up.,1,text_185_image_2410,coco_t2i
id_75_sd_2_1_2.png,TWO LADIES ARE OUT SPENDING THE DAY SKIING,1,text_75_image_985,coco_t2i
id_175_sd_1_4_1.png,A kneeling woman takes a photo of a park bench.,0,text_175_image_2280,coco_t2i
id_48_sd_1_4_1.png,A beautiful woman with red hair sitting at a table.,1,text_48_image_629,coco_t2i
id_192_sd_2_1_3.png,A man riding a water ski kicking up waves.,1,text_192_image_2507,coco_t2i
id_177_sd_2_1_3.png,We are looking up at a street sign with a building in the background.,1,text_177_image_2312,coco_t2i
id_98_Gary Marcus et al. _sd_1_4_1.png,An elephant is behind a tree. You can see the trunk on one side and the back legs on the other.,0,text_98_image_929,drawbench
id_15_sd_2_1_2.png,A dog and cat lying  together on an orange couch.,1,text_15_image_205,coco_t2i
id_10_sd_1_4_3.png,A red fire hydrant is leaking onto a side walk.,1,text_10_image_137,coco_t2i
id_157_Reddit_sd_2_1_1.png,"An old photograph of a 1920s airship shaped like a pig, floating over a wheat field.",0,text_157_image_1497,drawbench
id_59_sd_1_4_0.png,A water bird stands on the shore as the tide comes in.,1,text_59_image_771,coco_t2i
id_197_Text_sd_2_1_1.png,New York Skyline with 'Deep Learning' written with fireworks on the sky.,0,text_197_image_1941,drawbench
id_119_sd_2_1_0.png,a man is riding a skateboard in the street,1,text_119_image_1555,coco_t2i
id_199_sd_1_4_3.png,a kitchen with a refrigerator and tiled floors,1,text_199_image_2594,coco_t2i
id_121_sd_1_4_3.png,A surfer sits on his surfboard in the sand close to the water.,0,text_121_image_1580,coco_t2i
id_0_sd_1_4_2.png,A child holding a flowered umbrella and petting a yak.,0,text_0_image_6,coco_t2i
id_164_Reddit_sd_1_4_2.png,A screenshot of an iOS app for ordering different types of milk.,0,text_164_image_1554,drawbench
id_149_sd_2_1_2.png,Several people play a game with a Frisbee in a park.,1,text_149_image_1947,coco_t2i
id_16_Colors_sd_1_4_1.png,A blue bird and a brown bear.,1,text_16_image_197,drawbench
id_18_Colors_sd_1_4_0.png,A green cup and a blue cell phone.,0,text_18_image_220,drawbench
id_191_coco_val_0.png,A large plate is adorned with broccoli and a rather small piece of meat.,1,text_191_image_2495,coco_t2i
id_155_sd_1_4_1.png,A bacon wrapped hotdog on a bun with onions,0,text_155_image_2020,coco_t2i
id_76_sd_1_4_0.png,A sandwich is next to a yellow stuffed animal.,0,text_76_image_992,coco_t2i
id_66_coco_val_0.png,A large brown dog walking in front of a woman holding two ski poles.,1,text_66_image_870,coco_t2i
id_137_Rare Words_sd_2_1_1.png,Peristeronic.,0,text_137_image_1281,drawbench
id_8_Colors_sd_1_4_3.png,A black colored banana.,1,text_8_image_103,drawbench
id_14_Colors_sd_1_4_3.png,A brown colored giraffe.,1,text_14_image_175,drawbench
id_95_Gary Marcus et al. _sd_2_1_3.png,An oil painting of a couple in formal evening wear going home get caught in a heavy downpour with no umbrellas.,0,text_95_image_899,drawbench
id_127_coco_val_0.png,a man is reaching back with a tennis racket,1,text_127_image_1663,coco_t2i
id_125_sd_2_1_2.png,Girl trying out a game at a trade show.,1,text_125_image_1635,coco_t2i
id_146_Reddit_sd_1_4_0.png,"A fluffy baby sloth with a knitted hat trying to figure out a laptop, close up, highly detailed, studio lighting, screen reflecting in its eyes.",1,text_146_image_1372,drawbench
id_175_coco_val_0.png,A kneeling woman takes a photo of a park bench.,1,text_175_image_2287,coco_t2i
id_27_sd_2_1_1.png,A grasshopper in a cage eating a slice of carrot.,1,text_27_image_360,coco_t2i
id_179_Text_sd_1_4_0.png,A storefront with 'Hello World' written on it.,0,text_179_image_1720,drawbench
id_166_sd_2_1_3.png,A man talking on a phone standing in front of a building.,0,text_166_image_2169,coco_t2i
id_95_Gary Marcus et al. _sd_2_1_2.png,An oil painting of a couple in formal evening wear going home get caught in a heavy downpour with no umbrellas.,0,text_95_image_898,drawbench
id_67_DALL-E_sd_2_1_3.png,"A stack of 3 cubes. A red cube is on the top, sitting on a red cube. The red cube is in the middle, sitting on a green cube. The green cube is on the bottom.",0,text_67_image_815,drawbench
id_170_Reddit_sd_1_4_3.png,"A bridge connecting Europe and North America on the Atlantic Ocean, bird's eye view.",0,text_170_image_1627,drawbench
id_150_sd_1_4_1.png,A large white horse walking along side the road.,1,text_150_image_1955,coco_t2i
id_179_sd_2_1_3.png,An orange tabby cat is curled up fast asleep on the top of a sofa cushion.,1,text_179_image_2338,coco_t2i
id_41_coco_val_0.png,"A young baseball player in uniform getting ready to bat.,",1,text_41_image_545,coco_t2i
id_180_Text_sd_1_4_1.png,A storefront with 'Diffusion' written on it.,1,text_180_image_1733,drawbench
id_120_sd_2_1_0.png,"A white dish plated with corn, carrots, tomatoes, onions, olives, herbs and oil.",1,text_120_image_1568,coco_t2i
id_179_sd_2_1_2.png,An orange tabby cat is curled up fast asleep on the top of a sofa cushion.,1,text_179_image_2337,coco_t2i
id_29_Conflicting_sd_1_4_2.png,Hovering cow abducting aliens.,0,text_29_image_354,drawbench
id_138_Rare Words_sd_2_1_2.png,Artophagous.,0,text_138_image_1294,drawbench
id_190_Text_sd_1_4_1.png,A sign that says 'Deep Learning'.,0,text_190_image_1853,drawbench
id_134_coco_val_0.png,A cat on a toilet seat of some sort.,1,text_134_image_1754,coco_t2i
id_156_Reddit_sd_1_4_1.png,Greek statue of a man tripping over a cat.,1,text_156_image_1481,drawbench
id_6_Colors_sd_2_1_3.png,A green colored banana.,1,text_6_image_83,drawbench
id_66_sd_1_4_1.png,A large brown dog walking in front of a woman holding two ski poles.,1,text_66_image_863,coco_t2i
id_22_Colors_sd_2_1_2.png,A black apple and a green backpack.,0,text_22_image_274,drawbench
id_192_coco_val_0.png,A man riding a water ski kicking up waves.,1,text_192_image_2508,coco_t2i
id_99_Gary Marcus et al. _sd_2_1_1.png,A tomato has been put on top of a pumpkin on a kitchen stool. There is a fork sticking into the pumpkin. The scene is viewed from above.,0,text_99_image_945,drawbench
id_174_Reddit_sd_1_4_1.png,Darth Vader playing with raccoon in Mars during sunset.,0,text_174_image_1673,drawbench
id_73_DALL-E_sd_2_1_2.png,A cross-section view of a brain.,1,text_73_image_886,drawbench
id_194_Text_sd_1_4_1.png,New York Skyline with 'Diffusion' written with fireworks on the sky.,0,text_194_image_1901,drawbench
id_72_sd_1_4_3.png,a group of people picking out bananas from carts,1,text_72_image_943,coco_t2i
id_1_sd_1_4_1.png,A toilet sitting in a bathroom next to a sink.,1,text_1_image_18,coco_t2i
id_101_Gary Marcus et al. _sd_2_1_2.png,"A donkey and an octopus are playing a game. The donkey is holding a rope on one end, the octopus is holding onto the other. The donkey holds the rope in its mouth. A cat is jumping over the rope.",0,text_101_image_970,drawbench
id_113_sd_2_1_2.png,A man working on ski bindings with other ski gear around in a living area,1,text_113_image_1479,coco_t2i
id_127_sd_2_1_2.png,a man is reaching back with a tennis racket,0,text_127_image_1661,coco_t2i
id_29_coco_val_0.png,Persons skating in the ice skating rink on the skateboard.,0,text_29_image_389,coco_t2i
id_183_sd_2_1_0.png,Dog lying on bedding material in suitcase in large room.,1,text_183_image_2387,coco_t2i
id_16_Colors_sd_2_1_1.png,A blue bird and a brown bear.,0,text_16_image_201,drawbench
id_145_sd_1_4_1.png,A baby elephant and an adult elephant in sandy area.,0,text_145_image_1890,coco_t2i
id_117_sd_1_4_3.png,A man snowboard down the side of a snow covered slope.,1,text_117_image_1528,coco_t2i
id_103_sd_1_4_0.png,A large group of people on a couple boats in the water.,0,text_103_image_1343,coco_t2i
id_66_sd_1_4_2.png,A large brown dog walking in front of a woman holding two ski poles.,0,text_66_image_864,coco_t2i
id_7_sd_2_1_0.png,A giraffe lying on the ground in a zoo pin.,1,text_7_image_99,coco_t2i
id_140_Rare Words_sd_1_4_2.png,Octothorpe.,0,text_140_image_1314,drawbench
id_139_Rare Words_sd_2_1_0.png,Backlotter.,0,text_139_image_1304,drawbench
id_66_DALL-E_sd_2_1_0.png,"A stack of 3 plates. A blue plate is on the top, sitting on a blue plate. The blue plate is in the middle, sitting on a green plate. The green plate is on the bottom.",0,text_66_image_800,drawbench
id_85_sd_1_4_2.png,A kitchen with a stainless steel stove.and white cabinets.,1,text_85_image_1111,coco_t2i
id_20_sd_1_4_0.png,A lone elephant is walking through a field,1,text_20_image_264,coco_t2i
id_113_sd_2_1_3.png,A man working on ski bindings with other ski gear around in a living area,1,text_113_image_1480,coco_t2i
id_66_DALL-E_sd_2_1_1.png,"A stack of 3 plates. A blue plate is on the top, sitting on a blue plate. The blue plate is in the middle, sitting on a green plate. The green plate is on the bottom.",0,text_66_image_801,drawbench
id_138_Rare Words_sd_1_4_1.png,Artophagous.,0,text_138_image_1289,drawbench
id_53_sd_2_1_2.png,An airplane parked next to a terminal ready for passengers to board.,0,text_53_image_699,coco_t2i
id_51_coco_val_0.png,"A plate with chicken,carrots and mashed potatoes with silverware.",1,text_51_image_675,coco_t2i
id_116_sd_2_1_2.png,A young boy riding a skateboard and wearing a helmet.,1,text_116_image_1518,coco_t2i
id_192_Text_sd_2_1_0.png,A sign that says 'Google Research Pizza Cafe'.,1,text_192_image_1880,drawbench
id_63_DALL-E_sd_2_1_3.png,An illustration of a large red elephant sitting on a small blue mouse.,0,text_63_image_767,drawbench
id_37_Counting_sd_1_4_1.png,Three cars on the street.,0,text_37_image_449,drawbench
id_167_Reddit_sd_1_4_3.png,Photo of a mega Lego space station inside a kid's bedroom.,0,text_167_image_1591,drawbench
id_174_Reddit_sd_1_4_2.png,Darth Vader playing with raccoon in Mars during sunset.,0,text_174_image_1674,drawbench
id_54_DALL-E_sd_2_1_0.png,A triangular purple flower pot. A purple flower pot in the shape of a triangle.,1,text_54_image_656,drawbench
id_84_coco_val_0.png,a person sitting on the ground with a laptop,1,text_84_image_1104,coco_t2i
id_136_sd_1_4_0.png,A black cat sleeping in the sun on a bench,1,text_136_image_1772,coco_t2i
id_158_sd_1_4_1.png,A MAN WITH A BIRTHDAY CUPCAKE BLOWING OUT CANDLES,0,text_158_image_2059,coco_t2i
id_136_Rare Words_sd_2_1_0.png,Matutinal.,0,text_136_image_1268,drawbench
id_76_sd_2_1_0.png,A sandwich is next to a yellow stuffed animal.,0,text_76_image_996,coco_t2i
id_5_Colors_sd_1_4_1.png,A blue colored dog.,1,text_5_image_65,drawbench
id_25_sd_1_4_2.png,A stack of banana's sitting next  to a pear and a pile of apples.,0,text_25_image_331,coco_t2i
id_51_sd_2_1_2.png,"A plate with chicken,carrots and mashed potatoes with silverware.",1,text_51_image_673,coco_t2i
id_96_sd_2_1_3.png,A train traveling through a dark tunnel next to green brush..,0,text_96_image_1259,coco_t2i
id_123_sd_1_4_1.png,A person is on a living room couch watching TV and there is a stuffed panda bear and a purse on the table.,0,text_123_image_1604,coco_t2i
id_157_coco_val_0.png,"A very long table full of different kinds of food, which people are lining up to eat",1,text_157_image_2053,coco_t2i
id_95_sd_1_4_3.png,A train traveling under a bridge next to a bunch of trees.,0,text_95_image_1242,coco_t2i
id_198_sd_1_4_0.png,A baseball player holding a bat walking across a field.,0,text_198_image_2578,coco_t2i
id_122_coco_val_0.png,Man playing tennis with tennis racket on court,1,text_122_image_1598,coco_t2i
id_187_Text_sd_1_4_3.png,A sign that says 'Diffusion'.,0,text_187_image_1819,drawbench
id_60_sd_1_4_1.png,A hard to miss street sign set between two traffic lights.,0,text_60_image_785,coco_t2i
id_73_DALL-E_sd_1_4_0.png,A cross-section view of a brain.,1,text_73_image_880,drawbench
id_157_sd_2_1_0.png,"A very long table full of different kinds of food, which people are lining up to eat",0,text_157_image_2049,coco_t2i
id_186_sd_2_1_1.png,A computer desk topped with a desktop computer and a laptop.,0,text_186_image_2427,coco_t2i
id_97_sd_2_1_2.png,Street art painted on the wall in an asian country.,1,text_97_image_1271,coco_t2i
id_148_Reddit_sd_2_1_1.png,A 1960s yearbook photo with animals dressed as humans.,0,text_148_image_1401,drawbench
id_67_DALL-E_sd_2_1_0.png,"A stack of 3 cubes. A red cube is on the top, sitting on a red cube. The red cube is in the middle, sitting on a green cube. The green cube is on the bottom.",0,text_67_image_812,drawbench
id_96_Gary Marcus et al. _sd_2_1_0.png,"A grocery store refrigerator has pint cartons of milk on the top shelf, quart cartons on the middle shelf, and gallon plastic jugs on the bottom shelf.",0,text_96_image_908,drawbench
id_185_sd_2_1_0.png,The man is posing with his umbrella up.,1,text_185_image_2413,coco_t2i
id_128_sd_1_4_0.png,an image of a child playing on a toy laptop,1,text_128_image_1668,coco_t2i
id_116_sd_2_1_3.png,A young boy riding a skateboard and wearing a helmet.,1,text_116_image_1519,coco_t2i
id_146_sd_2_1_0.png,A Pooh bear is sitting in a high chair.,1,text_146_image_1906,coco_t2i
id_121_sd_1_4_2.png,A surfer sits on his surfboard in the sand close to the water.,0,text_121_image_1579,coco_t2i
id_59_coco_val_0.png,A water bird stands on the shore as the tide comes in.,1,text_59_image_779,coco_t2i
id_172_sd_2_1_1.png,The giraffe is sitting in the middle of the grass alone,0,text_172_image_2245,coco_t2i
id_174_sd_1_4_2.png,A red fire hydrant sitting in the middle of the grass.,1,text_174_image_2268,coco_t2i
id_171_Reddit_sd_2_1_1.png,"A maglev train going vertically downward in high speed, New York Times photojournalism.",0,text_171_image_1641,drawbench
id_143_Reddit_sd_2_1_1.png,"A baby fennec sneezing onto a strawberry, detailed, macro, studio light, droplets, backlit ears.",0,text_143_image_1341,drawbench
id_99_sd_1_4_3.png,A herd of cattle grazing on a dry grass covered field.,1,text_99_image_1294,coco_t2i
id_95_Gary Marcus et al. _sd_2_1_1.png,An oil painting of a couple in formal evening wear going home get caught in a heavy downpour with no umbrellas.,0,text_95_image_897,drawbench
id_33_Conflicting_sd_2_1_2.png,Rainbow coloured penguin.,1,text_33_image_406,drawbench
id_187_Text_sd_1_4_1.png,A sign that says 'Diffusion'.,0,text_187_image_1817,drawbench
id_193_Text_sd_2_1_0.png,New York Skyline with 'Hello World' written with fireworks on the sky.,0,text_193_image_1892,drawbench
id_141_sd_1_4_3.png,A large truck driving past a shopping center on a rain covered road.,1,text_141_image_1840,coco_t2i
id_47_sd_2_1_1.png,a kitchen with white counter tops and cabinets.,1,text_47_image_620,coco_t2i
id_57_sd_2_1_1.png,A traffic light hanging over a street next to cross walks.,0,text_57_image_750,coco_t2i
id_71_sd_1_4_3.png,"A lunch salad in a yellow bowl made out of fruit, vegetables, and meats with chopsticks. ",0,text_71_image_930,coco_t2i
id_44_Counting_sd_1_4_2.png,Five dogs on the street.,0,text_44_image_534,drawbench
id_175_Reddit_sd_1_4_2.png,A 1960s poster warning against climate change.,0,text_175_image_1686,drawbench
id_72_coco_val_0.png,a group of people picking out bananas from carts,1,text_72_image_948,coco_t2i
id_130_Positional_sd_2_1_0.png,A cat on the right of a tennis racket.,0,text_130_image_1196,drawbench
id_168_coco_val_0.png,A wooden bathroom with a wooden toilet next to a window.,1,text_168_image_2196,coco_t2i
id_162_Reddit_sd_2_1_3.png,Painting of Mona Lisa but the view is from behind of Mona Lisa.,0,text_162_image_1535,drawbench
id_98_Gary Marcus et al. _sd_2_1_0.png,An elephant is behind a tree. You can see the trunk on one side and the back legs on the other.,0,text_98_image_932,drawbench
id_103_sd_2_1_2.png,A large group of people on a couple boats in the water.,0,text_103_image_1349,coco_t2i
id_25_Conflicting_sd_1_4_1.png,A horse riding an astronaut.,0,text_25_image_305,drawbench
id_115_sd_2_1_2.png,a person in blue skies is skiing down a snowy hill,0,text_115_image_1505,coco_t2i
id_43_sd_2_1_0.png,A person jumping as they swing at a incoming tennis ball.,0,text_43_image_567,coco_t2i
id_175_Reddit_sd_2_1_2.png,A 1960s poster warning against climate change.,1,text_175_image_1690,drawbench
id_4_Colors_sd_1_4_2.png,A red colored dog.,1,text_4_image_54,drawbench
id_184_Text_sd_1_4_3.png,A storefront with 'Google Brain Toronto' written on it.,0,text_184_image_1783,drawbench
id_176_Reddit_sd_2_1_0.png,Illustration of a mouse using a mushroom as an umbrella.,0,text_176_image_1700,drawbench
id_77_sd_1_4_2.png,A guy with a white shirt and jeans riding a skateboard.,1,text_77_image_1007,coco_t2i
id_46_Counting_sd_2_1_0.png,One cat and two dogs sitting on the grass.,1,text_46_image_560,drawbench
id_26_Conflicting_sd_2_1_2.png,A pizza cooking an oven.,1,text_26_image_322,drawbench
id_37_sd_2_1_0.png,A young girl brushing her teeth with a tooth brush.,1,text_37_image_489,coco_t2i
id_117_Positional_sd_2_1_3.png,An umbrella on top of a spoon.,0,text_117_image_1043,drawbench
id_17_sd_2_1_3.png,A brown and white cat is in a suitcase.,1,text_17_image_232,coco_t2i
id_40_sd_1_4_3.png,A baseball player is swinging and about to run.,1,text_40_image_527,coco_t2i
id_7_Colors_sd_1_4_3.png,A red colored banana.,1,text_7_image_91,drawbench
id_143_sd_2_1_0.png,A man sanding next to a cow in a pen.,0,text_143_image_1867,coco_t2i
id_199_Text_sd_2_1_1.png,New York Skyline with 'Google Research Pizza Cafe' written with fireworks on the sky.,0,text_199_image_1965,drawbench
id_36_sd_2_1_2.png,A plate that has a dessert on it.,1,text_36_image_478,coco_t2i
id_43_Counting_sd_1_4_0.png,Four dogs on the street.,1,text_43_image_520,drawbench
id_114_Positional_sd_2_1_0.png,A train on top of a surfboard.,0,text_114_image_1004,drawbench
id_89_sd_1_4_0.png,A dirt bike rider doing a stunt jump in the air,1,text_89_image_1161,coco_t2i
id_161_sd_1_4_1.png,A boy playing a WII game at Christmas time.,0,text_161_image_2098,coco_t2i
id_193_Text_sd_1_4_0.png,New York Skyline with 'Hello World' written with fireworks on the sky.,0,text_193_image_1888,drawbench
id_9_Colors_sd_2_1_2.png,A white colored sandwich.,1,text_9_image_118,drawbench
id_12_sd_2_1_3.png,A bus traveling on a freeway next to other traffic.,1,text_12_image_167,coco_t2i
id_195_Text_sd_2_1_3.png,New York Skyline with 'Text to Image' written with fireworks on the sky.,0,text_195_image_1919,drawbench
id_195_sd_2_1_0.png,The bottom half of a tennis player holding a racket.,0,text_195_image_2543,coco_t2i
id_153_sd_2_1_2.png,A bowl of cooked noodles and broccoli in sauce,1,text_153_image_1999,coco_t2i
id_120_Positional_sd_2_1_1.png,A donut underneath a toilet.,0,text_120_image_1077,drawbench
id_143_Reddit_sd_1_4_1.png,"A baby fennec sneezing onto a strawberry, detailed, macro, studio light, droplets, backlit ears.",0,text_143_image_1337,drawbench
id_38_sd_1_4_0.png,A boy draped in a blanket holds a remote control on a couch,0,text_38_image_498,coco_t2i
id_193_sd_2_1_2.png,A guy on a snow board up in the air.,1,text_193_image_2519,coco_t2i
id_78_sd_2_1_1.png,A plate filled with a cut in half sandwich on top of a black table.,0,text_78_image_1023,coco_t2i
id_15_Colors_sd_1_4_2.png,A red car and a white sheep.,0,text_15_image_186,drawbench
id_65_DALL-E_sd_1_4_3.png,A small blue book sitting on a large red book.,1,text_65_image_787,drawbench
id_192_sd_2_1_2.png,A man riding a water ski kicking up waves.,1,text_192_image_2506,coco_t2i
id_111_sd_2_1_0.png,Woman holding a banana pointed at the camera.,1,text_111_image_1451,coco_t2i
id_91_sd_2_1_2.png,A blue and yellow fire hydrant next to a yellow cone.,0,text_91_image_1193,coco_t2i
id_162_Reddit_sd_1_4_0.png,Painting of Mona Lisa but the view is from behind of Mona Lisa.,0,text_162_image_1528,drawbench
id_57_DALL-E_sd_2_1_2.png,A cube made of denim. A cube with the texture of denim.,1,text_57_image_694,drawbench
id_195_Text_sd_1_4_1.png,New York Skyline with 'Text to Image' written with fireworks on the sky.,0,text_195_image_1913,drawbench
id_194_Text_sd_2_1_1.png,New York Skyline with 'Diffusion' written with fireworks on the sky.,0,text_194_image_1905,drawbench
id_148_Reddit_sd_1_4_1.png,A 1960s yearbook photo with animals dressed as humans.,0,text_148_image_1397,drawbench
id_139_sd_2_1_2.png,a big boat is going down a small river,0,text_139_image_1817,coco_t2i
