image,text,label,original_dataset_id,dataset_source
id_49_Counting_sd_2_1_3.png,Two cats and two dogs sitting on the grass.,0,text_49_image_599,drawbench
id_14_sd_2_1_2.png,A cat sitting on top of a red boat next to two dogs.,0,text_14_image_192,coco_t2i
id_146_sd_1_4_2.png,A Pooh bear is sitting in a high chair.,1,text_146_image_1904,coco_t2i
id_187_Text_sd_2_1_1.png,A sign that says 'Diffusion'.,0,text_187_image_1821,drawbench
id_45_Counting_sd_1_4_2.png,One cat and one dog sitting on the grass.,1,text_45_image_546,drawbench
id_132_sd_2_1_3.png,A row of wall mounted sinks in a restroom.,1,text_132_image_1727,coco_t2i
id_30_sd_2_1_2.png,A person is seen using a snowboard on the packed snow.,1,text_30_image_400,coco_t2i
id_92_sd_2_1_2.png,The view of a giraffe through some vegetation.,1,text_92_image_1206,coco_t2i
id_199_Text_sd_1_4_3.png,New York Skyline with 'Google Research Pizza Cafe' written with fireworks on the sky.,0,text_199_image_1963,drawbench
id_77_sd_1_4_3.png,A guy with a white shirt and jeans riding a skateboard.,1,text_77_image_1008,coco_t2i
id_114_Positional_sd_1_4_0.png,A train on top of a surfboard.,0,text_114_image_1000,drawbench
id_192_sd_1_4_3.png,A man riding a water ski kicking up waves.,1,text_192_image_2503,coco_t2i
id_57_sd_1_4_1.png,A traffic light hanging over a street next to cross walks.,0,text_57_image_746,coco_t2i
id_148_sd_1_4_0.png,Zebras and rhinos out in the wild on a sunny day,0,text_148_image_1928,coco_t2i
id_48_sd_1_4_0.png,A beautiful woman with red hair sitting at a table.,1,text_48_image_628,coco_t2i
id_38_Counting_sd_1_4_0.png,Four cars on the street.,0,text_38_image_460,drawbench
id_114_sd_2_1_0.png,Pasta and vegetable salad served in bowl with meat and cheese.,1,text_114_image_1490,coco_t2i
id_121_sd_2_1_2.png,A surfer sits on his surfboard in the sand close to the water.,0,text_121_image_1583,coco_t2i
id_175_sd_2_1_3.png,A kneeling woman takes a photo of a park bench.,1,text_175_image_2286,coco_t2i
id_26_sd_1_4_2.png,"A fork next to an apple, orange and onion.",0,text_26_image_344,coco_t2i
id_166_Reddit_sd_1_4_1.png,Colouring page of large cats climbing the eifel tower in a cyberpunk future.,0,text_166_image_1577,drawbench
id_43_sd_2_1_3.png,A person jumping as they swing at a incoming tennis ball.,1,text_43_image_570,coco_t2i
id_125_Positional_sd_2_1_3.png,A couch on the left of a chair.,0,text_125_image_1139,drawbench
id_181_sd_1_4_1.png,A ferry going from one point to another point.,1,text_181_image_2358,coco_t2i
id_21_sd_1_4_2.png,Large elephant rubbing itself up against a large tree.,1,text_21_image_279,coco_t2i
id_190_coco_val_0.png,a large pizza is in a cardboard box,1,text_190_image_2482,coco_t2i
id_95_Gary Marcus et al. _sd_2_1_0.png,An oil painting of a couple in formal evening wear going home get caught in a heavy downpour with no umbrellas.,0,text_95_image_896,drawbench
id_46_Counting_sd_1_4_0.png,One cat and two dogs sitting on the grass.,0,text_46_image_556,drawbench
id_150_Reddit_sd_2_1_0.png,A yellow and black bus cruising through the rainforest.,1,text_150_image_1424,drawbench
id_118_sd_2_1_2.png,A man riding a skateboard down a hall.,1,text_118_image_1544,coco_t2i
id_157_sd_2_1_1.png,"A very long table full of different kinds of food, which people are lining up to eat",1,text_157_image_2050,coco_t2i
id_98_sd_1_4_3.png,A train pulls up along some buildings.,1,text_98_image_1281,coco_t2i
id_122_sd_2_1_1.png,Man playing tennis with tennis racket on court,1,text_122_image_1595,coco_t2i
id_28_sd_1_4_0.png,A little girl sitting in the middle of a restaurant and smiling for picture.,1,text_28_image_368,coco_t2i
id_138_sd_2_1_0.png,A green pasture with lots of animals in the foreground and mountains in the back.,1,text_138_image_1802,coco_t2i
id_101_sd_2_1_3.png,A man with glasses and a tie clip sits in his car.,0,text_101_image_1324,coco_t2i
id_73_coco_val_0.png,A person in  a white jacket skiing down a slope,1,text_73_image_961,coco_t2i
id_27_Conflicting_sd_1_4_0.png,A bird scaring a scarecrow.,0,text_27_image_328,drawbench
id_54_sd_1_4_2.png,A cat sitting up on its hind feet on a park bench,1,text_54_image_708,coco_t2i
id_184_Text_sd_2_1_0.png,A storefront with 'Google Brain Toronto' written on it.,0,text_184_image_1784,drawbench
id_114_Positional_sd_2_1_2.png,A train on top of a surfboard.,0,text_114_image_1006,drawbench
id_140_sd_1_4_0.png,A mirror that is on a tiled wall.,0,text_140_image_1824,coco_t2i
id_144_sd_2_1_2.png,Dairy cows line up against a barber wire fence to graze the sweeter grass.,0,text_144_image_1882,coco_t2i
id_11_sd_2_1_2.png,That looks like a wall mural in the background of this photo with a lot of sheet.,1,text_11_image_153,coco_t2i
id_191_Text_sd_2_1_0.png,A sign that says 'Google Brain Toronto'.,0,text_191_image_1868,drawbench
id_129_sd_1_4_2.png,A refrigerator sitting in front of a vandalized wall.,0,text_129_image_1683,coco_t2i
id_127_sd_1_4_0.png,a man is reaching back with a tennis racket,0,text_127_image_1655,coco_t2i
id_189_Text_sd_2_1_0.png,A sign that says 'NeurIPS'.,0,text_189_image_1844,drawbench
id_139_sd_1_4_3.png,a big boat is going down a small river,0,text_139_image_1814,coco_t2i
id_28_sd_2_1_1.png,A little girl sitting in the middle of a restaurant and smiling for picture.,1,text_28_image_373,coco_t2i
id_156_sd_1_4_3.png,Sugar donuts sitting in a white paper bag.,1,text_156_image_2035,coco_t2i
id_132_sd_2_1_1.png,A row of wall mounted sinks in a restroom.,1,text_132_image_1725,coco_t2i
id_42_sd_1_4_0.png,a tennis player attempting to reach a tennis ball,0,text_42_image_550,coco_t2i
id_166_sd_1_4_1.png,A man talking on a phone standing in front of a building.,1,text_166_image_2163,coco_t2i
id_74_sd_2_1_2.png,A pair of red and black skis on a white background.,0,text_74_image_972,coco_t2i
id_124_Positional_sd_2_1_3.png,A banana on the left of an apple.,1,text_124_image_1127,drawbench
id_70_sd_2_1_1.png,Two girls sitting on a bed eating bananas together.,1,text_70_image_919,coco_t2i
id_56_sd_2_1_3.png,A man pushing a wheelchair on the street.,0,text_56_image_739,coco_t2i
id_143_Reddit_sd_2_1_3.png,"A baby fennec sneezing onto a strawberry, detailed, macro, studio light, droplets, backlit ears.",0,text_143_image_1343,drawbench
id_119_Positional_sd_1_4_1.png,A giraffe underneath a microwave.,0,text_119_image_1061,drawbench
id_50_Counting_sd_1_4_1.png,Two cats and three dogs sitting on the grass.,0,text_50_image_605,drawbench
id_18_sd_1_4_2.png,Two cows overlooking a mountain range and one is looking in the opposite direction of the other one.,1,text_18_image_240,coco_t2i
id_130_sd_2_1_3.png,there is a small glass vase that has purple flowers in it,1,text_130_image_1701,coco_t2i
id_102_Gary Marcus et al. _sd_2_1_3.png,"Supreme Court Justices play a baseball game with the FBI. The FBI is at bat, the justices are on the field.",0,text_102_image_983,drawbench
id_32_Conflicting_sd_2_1_3.png,An elephant under the sea.,1,text_32_image_395,drawbench
id_0_sd_2_1_3.png,A child holding a flowered umbrella and petting a yak.,1,text_0_image_11,coco_t2i
id_11_sd_1_4_0.png,That looks like a wall mural in the background of this photo with a lot of sheet.,1,text_11_image_147,coco_t2i
id_130_sd_1_4_2.png,there is a small glass vase that has purple flowers in it,1,text_130_image_1696,coco_t2i
id_152_Reddit_sd_1_4_0.png,"An IT-guy trying to fix hardware of a PC tower is being tangled by the PC cables like Laokoon. Marble, copy after Hellenistic original from ca. 200 BC. Found in the Baths of Trajan, 1506.",1,text_152_image_1444,drawbench
id_161_sd_2_1_0.png,A boy playing a WII game at Christmas time.,1,text_161_image_2101,coco_t2i
id_15_Colors_sd_2_1_2.png,A red car and a white sheep.,1,text_15_image_190,drawbench
id_99_coco_val_0.png,A herd of cattle grazing on a dry grass covered field.,1,text_99_image_1299,coco_t2i
id_151_Reddit_sd_2_1_1.png,A medieval painting of the wifi not working.,0,text_151_image_1437,drawbench
id_128_Positional_sd_1_4_1.png,A carrot on the left of a broccoli.,1,text_128_image_1169,drawbench
id_14_Colors_sd_1_4_1.png,A brown colored giraffe.,1,text_14_image_173,drawbench
id_120_coco_val_0.png,"A white dish plated with corn, carrots, tomatoes, onions, olives, herbs and oil.",1,text_120_image_1572,coco_t2i
id_131_sd_1_4_3.png,The reflection of a man taking  a picture in a mirror,1,text_131_image_1710,coco_t2i
id_18_sd_2_1_3.png,Two cows overlooking a mountain range and one is looking in the opposite direction of the other one.,0,text_18_image_245,coco_t2i
id_173_sd_1_4_0.png,A yellow and green fire hydrant in Canada.,0,text_173_image_2253,coco_t2i
id_65_sd_1_4_2.png,A crowd of people standing in front of a window.,1,text_65_image_851,coco_t2i
id_164_Reddit_sd_2_1_2.png,A screenshot of an iOS app for ordering different types of milk.,0,text_164_image_1558,drawbench
id_66_sd_1_4_3.png,A large brown dog walking in front of a woman holding two ski poles.,1,text_66_image_865,coco_t2i
id_25_sd_1_4_1.png,A stack of banana's sitting next  to a pear and a pile of apples.,0,text_25_image_330,coco_t2i
id_67_sd_2_1_2.png,Three teddy bears laying in bed under the covers.,0,text_67_image_881,coco_t2i
id_98_Gary Marcus et al. _sd_2_1_1.png,An elephant is behind a tree. You can see the trunk on one side and the back legs on the other.,0,text_98_image_933,drawbench
id_37_sd_1_4_3.png,A young girl brushing her teeth with a tooth brush.,1,text_37_image_488,coco_t2i
id_152_Reddit_sd_2_1_3.png,"An IT-guy trying to fix hardware of a PC tower is being tangled by the PC cables like Laokoon. Marble, copy after Hellenistic original from ca. 200 BC. Found in the Baths of Trajan, 1506.",0,text_152_image_1451,drawbench
id_108_sd_1_4_1.png,a girl jumping in the air to catch a frisbee,0,text_108_image_1409,coco_t2i
id_10_coco_val_0.png,A red fire hydrant is leaking onto a side walk.,1,text_10_image_142,coco_t2i
id_167_sd_1_4_1.png,A man on a bike near people on a bench,0,text_167_image_2176,coco_t2i
id_56_DALL-E_sd_2_1_1.png,A triangular pink stop sign. A pink stop sign in the shape of a triangle.,0,text_56_image_681,drawbench
id_171_Reddit_sd_2_1_0.png,"A maglev train going vertically downward in high speed, New York Times photojournalism.",0,text_171_image_1640,drawbench
id_73_DALL-E_sd_2_1_0.png,A cross-section view of a brain.,1,text_73_image_884,drawbench
id_8_Colors_sd_2_1_2.png,A black colored banana.,1,text_8_image_106,drawbench
id_102_Gary Marcus et al. _sd_2_1_1.png,"Supreme Court Justices play a baseball game with the FBI. The FBI is at bat, the justices are on the field.",1,text_102_image_981,drawbench
id_10_sd_2_1_0.png,A red fire hydrant is leaking onto a side walk.,0,text_10_image_138,coco_t2i
id_175_sd_1_4_0.png,A kneeling woman takes a photo of a park bench.,0,text_175_image_2279,coco_t2i
id_113_coco_val_0.png,A man working on ski bindings with other ski gear around in a living area,1,text_113_image_1481,coco_t2i
id_189_sd_1_4_0.png,A plate of chicken with herbs and steamed broccoli.,1,text_189_image_2461,coco_t2i
id_163_sd_2_1_1.png,A brown teddy bear sitting on top of a table in front of a white plate with a piece of pie.,0,text_163_image_2128,coco_t2i
id_185_coco_val_0.png,The man is posing with his umbrella up.,1,text_185_image_2417,coco_t2i
id_25_Conflicting_sd_1_4_0.png,A horse riding an astronaut.,0,text_25_image_304,drawbench
id_92_sd_1_4_1.png,The view of a giraffe through some vegetation.,1,text_92_image_1201,coco_t2i
id_122_Positional_sd_2_1_3.png,A tennis racket underneath a traffic light.,0,text_122_image_1103,drawbench
id_21_sd_1_4_3.png,Large elephant rubbing itself up against a large tree.,0,text_21_image_280,coco_t2i
id_181_Text_sd_1_4_2.png,A storefront with 'Text to Image' written on it.,0,text_181_image_1746,drawbench
id_190_Text_sd_1_4_0.png,A sign that says 'Deep Learning'.,1,text_190_image_1852,drawbench
id_196_sd_2_1_3.png,A boy putting something in his mouth and smiling for a picture.,1,text_196_image_2559,coco_t2i
id_32_Conflicting_sd_1_4_1.png,An elephant under the sea.,0,text_32_image_389,drawbench
id_188_Text_sd_2_1_0.png,A sign that says 'Text to Image'.,0,text_188_image_1832,drawbench
id_190_Text_sd_1_4_2.png,A sign that says 'Deep Learning'.,1,text_190_image_1854,drawbench
id_188_Text_sd_1_4_0.png,A sign that says 'Text to Image'.,0,text_188_image_1828,drawbench
id_57_sd_1_4_3.png,A traffic light hanging over a street next to cross walks.,0,text_57_image_748,coco_t2i
id_195_sd_2_1_2.png,The bottom half of a tennis player holding a racket.,0,text_195_image_2545,coco_t2i
id_168_sd_1_4_2.png,A wooden bathroom with a wooden toilet next to a window.,0,text_168_image_2190,coco_t2i
id_185_sd_2_1_2.png,The man is posing with his umbrella up.,1,text_185_image_2415,coco_t2i
id_123_sd_2_1_1.png,A person is on a living room couch watching TV and there is a stuffed panda bear and a purse on the table.,0,text_123_image_1608,coco_t2i
id_157_sd_2_1_3.png,"A very long table full of different kinds of food, which people are lining up to eat",0,text_157_image_2052,coco_t2i
id_150_sd_2_1_2.png,A large white horse walking along side the road.,1,text_150_image_1960,coco_t2i
id_173_Reddit_sd_2_1_2.png,"A car playing soccer, digital art.",1,text_173_image_1666,drawbench
id_71_sd_2_1_2.png,"A lunch salad in a yellow bowl made out of fruit, vegetables, and meats with chopsticks. ",0,text_71_image_933,coco_t2i
id_12_Colors_sd_2_1_0.png,A pink colored giraffe.,1,text_12_image_152,drawbench
id_116_sd_1_4_0.png,A young boy riding a skateboard and wearing a helmet.,1,text_116_image_1512,coco_t2i
id_131_sd_2_1_3.png,The reflection of a man taking  a picture in a mirror,1,text_131_image_1714,coco_t2i
id_100_Gary Marcus et al. _sd_2_1_3.png,A pear cut into seven pieces arranged in a ring.,0,text_100_image_959,drawbench
id_180_sd_2_1_0.png,A view of a lake and mountains from a boat.,1,text_180_image_2348,coco_t2i
id_116_sd_1_4_1.png,A young boy riding a skateboard and wearing a helmet.,0,text_116_image_1513,coco_t2i
id_4_sd_2_1_3.png,A woman is riding a motorcycle down the street.,1,text_4_image_63,coco_t2i
id_10_sd_1_4_2.png,A red fire hydrant is leaking onto a side walk.,0,text_10_image_136,coco_t2i
id_16_sd_1_4_3.png,Two cats sitting on top of a pair of shoes.,0,text_16_image_215,coco_t2i
id_88_sd_1_4_0.png,A white cat sitting on the floor next to a feeding dish and a mat.,0,text_88_image_1148,coco_t2i
id_198_Text_sd_2_1_0.png,New York Skyline with 'Google Brain Toronto' written with fireworks on the sky.,0,text_198_image_1952,drawbench
id_19_sd_2_1_2.png,A black kitten lays on her side beside remote controls.,1,text_19_image_257,coco_t2i
id_178_sd_1_4_2.png,The old tow truck tries to lift an overturned truck that's on it's side.,0,text_178_image_2320,coco_t2i
id_161_Reddit_sd_1_4_3.png,"A keyboard made of water, the water is made of light, the light is turned off.",0,text_161_image_1519,drawbench
id_66_DALL-E_sd_2_1_2.png,"A stack of 3 plates. A blue plate is on the top, sitting on a blue plate. The blue plate is in the middle, sitting on a green plate. The green plate is on the bottom.",0,text_66_image_802,drawbench
id_67_sd_2_1_0.png,Three teddy bears laying in bed under the covers.,0,text_67_image_879,coco_t2i
id_33_sd_1_4_0.png,A sheet cake sitting on top of a table with lit candles.,0,text_33_image_433,coco_t2i
id_1_sd_1_4_2.png,A toilet sitting in a bathroom next to a sink.,0,text_1_image_19,coco_t2i
id_161_Reddit_sd_1_4_0.png,"A keyboard made of water, the water is made of light, the light is turned off.",0,text_161_image_1516,drawbench
id_79_sd_1_4_1.png,White leather sofas with ottoman near lamps in orange living room.,0,text_79_image_1032,coco_t2i
id_146_sd_2_1_2.png,A Pooh bear is sitting in a high chair.,1,text_146_image_1908,coco_t2i
id_145_Reddit_sd_2_1_0.png,An ancient Egyptian painting depicting an argument over whose turn it is to take out the trash.,1,text_145_image_1364,drawbench
id_37_Counting_sd_2_1_0.png,Three cars on the street.,1,text_37_image_452,drawbench
id_41_Counting_sd_1_4_2.png,Two dogs on the street.,1,text_41_image_498,drawbench
id_199_Text_sd_1_4_2.png,New York Skyline with 'Google Research Pizza Cafe' written with fireworks on the sky.,0,text_199_image_1962,drawbench
id_3_Colors_sd_2_1_3.png,A black colored dog.,1,text_3_image_47,drawbench
id_36_sd_2_1_3.png,A plate that has a dessert on it.,1,text_36_image_479,coco_t2i
id_5_Colors_sd_2_1_2.png,A blue colored dog.,1,text_5_image_70,drawbench
id_27_Conflicting_sd_2_1_2.png,A bird scaring a scarecrow.,0,text_27_image_334,drawbench
id_41_sd_1_4_0.png,"A young baseball player in uniform getting ready to bat.,",1,text_41_image_537,coco_t2i
id_42_Counting_sd_1_4_1.png,Three dogs on the street.,0,text_42_image_509,drawbench
id_155_sd_1_4_2.png,A bacon wrapped hotdog on a bun with onions,0,text_155_image_2021,coco_t2i
id_195_sd_1_4_1.png,The bottom half of a tennis player holding a racket.,0,text_195_image_2540,coco_t2i
id_146_Reddit_sd_1_4_1.png,"A fluffy baby sloth with a knitted hat trying to figure out a laptop, close up, highly detailed, studio lighting, screen reflecting in its eyes.",1,text_146_image_1373,drawbench
id_164_coco_val_0.png,A man holding a baseball bat while standing on a baseball field.,1,text_164_image_2144,coco_t2i
id_17_sd_2_1_1.png,A brown and white cat is in a suitcase.,1,text_17_image_230,coco_t2i
id_31_sd_2_1_3.png,A lady sitting at an enormous dining table with lots of food.,1,text_31_image_414,coco_t2i
id_88_sd_1_4_1.png,A white cat sitting on the floor next to a feeding dish and a mat.,0,text_88_image_1149,coco_t2i
id_104_sd_1_4_2.png,A trunk full of backpacks and other bags.,1,text_104_image_1358,coco_t2i
id_44_sd_2_1_2.png,Two people are at a computer desk with a mouse.,0,text_44_image_582,coco_t2i
id_53_Counting_sd_2_1_3.png,Three cats and three dogs sitting on the grass.,0,text_53_image_647,drawbench
id_118_Positional_sd_1_4_1.png,A laptop on top of a teddy bear.,0,text_118_image_1049,drawbench
id_193_sd_1_4_0.png,A guy on a snow board up in the air.,1,text_193_image_2513,coco_t2i
id_45_sd_2_1_1.png,a women that is walking down a sidwalk,1,text_45_image_594,coco_t2i
id_38_sd_2_1_0.png,A boy draped in a blanket holds a remote control on a couch,1,text_38_image_502,coco_t2i
id_189_sd_1_4_3.png,A plate of chicken with herbs and steamed broccoli.,1,text_189_image_2464,coco_t2i
id_163_Reddit_sd_1_4_1.png,Hyper-realistic photo of an abandoned industrial site during a storm.,1,text_163_image_1541,drawbench
id_39_sd_2_1_3.png,This is a room full of laptop computers.,0,text_39_image_518,coco_t2i
id_5_sd_1_4_2.png,A building shines in the clear sky as cars drive underneath.,0,text_5_image_71,coco_t2i
id_138_Rare Words_sd_2_1_1.png,Artophagous.,0,text_138_image_1293,drawbench
id_100_Gary Marcus et al. _sd_1_4_1.png,A pear cut into seven pieces arranged in a ring.,1,text_100_image_953,drawbench
id_38_Counting_sd_2_1_1.png,Four cars on the street.,1,text_38_image_465,drawbench
id_144_sd_1_4_0.png,Dairy cows line up against a barber wire fence to graze the sweeter grass.,0,text_144_image_1876,coco_t2i
id_41_sd_2_1_0.png,"A young baseball player in uniform getting ready to bat.,",1,text_41_image_541,coco_t2i
id_115_Positional_sd_1_4_1.png,A wine glass on top of a dog.,0,text_115_image_1013,drawbench
id_47_Counting_sd_2_1_3.png,One cat and three dogs sitting on the grass.,0,text_47_image_575,drawbench
id_116_Positional_sd_2_1_2.png,A bicycle on top of a boat.,1,text_116_image_1030,drawbench
id_5_sd_1_4_0.png,A building shines in the clear sky as cars drive underneath.,0,text_5_image_69,coco_t2i
id_61_DALL-E_sd_1_4_3.png,A single clock is sitting on a table.,1,text_61_image_739,drawbench
id_172_sd_1_4_1.png,The giraffe is sitting in the middle of the grass alone,1,text_172_image_2241,coco_t2i
id_106_sd_2_1_3.png,A black dog running in a pen with a horse.,0,text_106_image_1389,coco_t2i
id_119_sd_1_4_1.png,a man is riding a skateboard in the street,1,text_119_image_1552,coco_t2i
id_98_sd_2_1_3.png,A train pulls up along some buildings.,1,text_98_image_1285,coco_t2i
id_62_sd_2_1_0.png,A cat drinking out of a glass on top of a table.,0,text_62_image_814,coco_t2i
id_166_coco_val_0.png,A man talking on a phone standing in front of a building.,1,text_166_image_2170,coco_t2i
id_50_sd_2_1_3.png,A very dirty looking rest room with two toilets.,0,text_50_image_661,coco_t2i
id_82_sd_2_1_0.png,a light a few ceiling fans a bicycle a couch and windows,0,text_82_image_1074,coco_t2i
id_183_sd_2_1_1.png,Dog lying on bedding material in suitcase in large room.,0,text_183_image_2388,coco_t2i
id_118_sd_1_4_2.png,A man riding a skateboard down a hall.,1,text_118_image_1540,coco_t2i
id_99_sd_2_1_3.png,A herd of cattle grazing on a dry grass covered field.,1,text_99_image_1298,coco_t2i
id_152_sd_1_4_1.png,A plate of noodles and broccoli are shown.,1,text_152_image_1981,coco_t2i
id_126_sd_1_4_3.png,Light breaks through a cloudy day at the pier.,1,text_126_image_1645,coco_t2i
id_148_sd_2_1_0.png,Zebras and rhinos out in the wild on a sunny day,0,text_148_image_1932,coco_t2i
id_38_Counting_sd_2_1_2.png,Four cars on the street.,1,text_38_image_466,drawbench
id_4_Colors_sd_2_1_1.png,A red colored dog.,1,text_4_image_57,drawbench
id_117_sd_1_4_0.png,A man snowboard down the side of a snow covered slope.,1,text_117_image_1525,coco_t2i
id_104_sd_1_4_1.png,A trunk full of backpacks and other bags.,1,text_104_image_1357,coco_t2i
id_127_Positional_sd_2_1_1.png,A cat on the left of a dog.,0,text_127_image_1161,drawbench
id_47_Counting_sd_1_4_1.png,One cat and three dogs sitting on the grass.,0,text_47_image_569,drawbench
id_29_sd_1_4_0.png,Persons skating in the ice skating rink on the skateboard.,0,text_29_image_381,coco_t2i
id_36_Counting_sd_1_4_3.png,Two cars on the street.,1,text_36_image_439,drawbench
id_14_sd_1_4_0.png,A cat sitting on top of a red boat next to two dogs.,0,text_14_image_186,coco_t2i
id_46_Counting_sd_1_4_1.png,One cat and two dogs sitting on the grass.,0,text_46_image_557,drawbench
id_106_sd_2_1_2.png,A black dog running in a pen with a horse.,1,text_106_image_1388,coco_t2i
id_42_Counting_sd_1_4_3.png,Three dogs on the street.,1,text_42_image_511,drawbench
id_163_Reddit_sd_2_1_1.png,Hyper-realistic photo of an abandoned industrial site during a storm.,1,text_163_image_1545,drawbench
id_6_sd_2_1_0.png,Two giraffe standing next to each other on a grassy field.,1,text_6_image_86,coco_t2i
id_34_Conflicting_sd_2_1_1.png,A fish eating a pelican.,0,text_34_image_417,drawbench
id_123_Positional_sd_1_4_1.png,A zebra underneath a broccoli.,0,text_123_image_1109,drawbench
id_67_sd_2_1_3.png,Three teddy bears laying in bed under the covers.,0,text_67_image_882,coco_t2i
id_26_Conflicting_sd_2_1_3.png,A pizza cooking an oven.,1,text_26_image_323,drawbench
id_32_sd_2_1_2.png,A person holding up a chocolate doughnut with a face drawn on it.,1,text_32_image_426,coco_t2i
id_72_DALL-E_sd_2_1_0.png,A side view of an owl sitting in a field.,1,text_72_image_872,drawbench
id_101_Gary Marcus et al. _sd_2_1_3.png,"A donkey and an octopus are playing a game. The donkey is holding a rope on one end, the octopus is holding onto the other. The donkey holds the rope in its mouth. A cat is jumping over the rope.",0,text_101_image_971,drawbench
id_108_sd_2_1_0.png,a girl jumping in the air to catch a frisbee,0,text_108_image_1412,coco_t2i
id_25_Conflicting_sd_2_1_3.png,A horse riding an astronaut.,0,text_25_image_311,drawbench
id_13_Colors_sd_1_4_1.png,A yellow colored giraffe.,0,text_13_image_161,drawbench
id_73_DALL-E_sd_1_4_2.png,A cross-section view of a brain.,1,text_73_image_882,drawbench
id_22_Colors_sd_1_4_1.png,A black apple and a green backpack.,0,text_22_image_269,drawbench
id_188_Text_sd_1_4_2.png,A sign that says 'Text to Image'.,0,text_188_image_1830,drawbench
id_80_sd_1_4_2.png,A woman holding a pizza up in the air.,1,text_80_image_1046,coco_t2i
id_175_sd_1_4_2.png,A kneeling woman takes a photo of a park bench.,1,text_175_image_2281,coco_t2i
id_24_Colors_sd_2_1_0.png,A red book and a yellow vase.,0,text_24_image_296,drawbench
id_1_sd_2_1_3.png,A toilet sitting in a bathroom next to a sink.,0,text_1_image_24,coco_t2i
id_32_Conflicting_sd_1_4_0.png,An elephant under the sea.,1,text_32_image_388,drawbench
id_75_sd_2_1_0.png,TWO LADIES ARE OUT SPENDING THE DAY SKIING,1,text_75_image_983,coco_t2i
id_167_Reddit_sd_2_1_2.png,Photo of a mega Lego space station inside a kid's bedroom.,0,text_167_image_1594,drawbench
id_114_Positional_sd_2_1_3.png,A train on top of a surfboard.,0,text_114_image_1007,drawbench
id_169_Reddit_sd_1_4_1.png,A photocopy of a photograph of a painting of a sculpture of a giraffe.,0,text_169_image_1613,drawbench
id_31_Conflicting_sd_1_4_1.png,A shark in the desert.,1,text_31_image_377,drawbench
id_48_sd_2_1_0.png,A beautiful woman with red hair sitting at a table.,1,text_48_image_632,coco_t2i
id_161_sd_1_4_3.png,A boy playing a WII game at Christmas time.,1,text_161_image_2100,coco_t2i
id_53_Counting_sd_1_4_2.png,Three cats and three dogs sitting on the grass.,0,text_53_image_642,drawbench
id_34_sd_1_4_1.png,A two layer cake sitting on top of a table.,1,text_34_image_447,coco_t2i
id_5_sd_2_1_1.png,A building shines in the clear sky as cars drive underneath.,0,text_5_image_74,coco_t2i
id_77_sd_1_4_0.png,A guy with a white shirt and jeans riding a skateboard.,1,text_77_image_1005,coco_t2i
id_77_coco_val_0.png,A guy with a white shirt and jeans riding a skateboard.,1,text_77_image_1013,coco_t2i
id_167_sd_2_1_3.png,A man on a bike near people on a bench,0,text_167_image_2182,coco_t2i
id_43_Counting_sd_2_1_3.png,Four dogs on the street.,1,text_43_image_527,drawbench
id_57_sd_2_1_2.png,A traffic light hanging over a street next to cross walks.,0,text_57_image_751,coco_t2i
id_193_coco_val_0.png,A guy on a snow board up in the air.,1,text_193_image_2521,coco_t2i
id_16_Colors_sd_1_4_3.png,A blue bird and a brown bear.,1,text_16_image_199,drawbench
